### ISSUE TITLE
Unable to handle HA on a different routed subnet to itself?

### ISSUE THREAD

**Issue by ThePlexus** [davesmeghead/visonic#200]
Im using a esp8266 / d1_mini on the panel. The integration is operational when both HA and ESP device are on the same subnet.

Recently I moved my HA machine to a different subnet. The router at 192.168.100.1/192.168.200.1 handles packet routing between the two subnets. After moving, the ESP device no longer responds. 

HA machine: 192.168.100.2 mask 255.255.255.0
ESP device: 192.168.200.10 / port 30000 / mask 255.255.255.0
Router eth port 1: 192.168.100.1 
Router eth port 2: 192.168.200.1

- This TCPdump is taken from port 2 on the router
- The TDPdump on port 2 of the router shows the SYN packet is being sent from the HA system, over the correct ethernet port towards the AP which the ESP is connected to. 
- A tcpdump on the AP shows the packet is transmitted over the wireless interface. 
- After receiving (and ignoring) the SYN from a different subnet, the ESP d1_mini device at 192.168.200.10 begins sending ARP requests for its own IP address (which makes no sense)

> > 10:53:20.721184 IP 192.168.100.2.33856 > 192.168.200.10.30000: Flags [S], seq 3891214052, win 64240, options [mss 1460,sackOK,TS val 3107846491 ecr 0,nop,wscale 7], length 0
	0x0000:  4500 003c f208 4000 3e06 d277 0a0a 4602  E..<..@.>..w..F.
	0x0010:  0a0a 1e26 8440 7530 e7ef 36e4 0000 0000  ...&.@u0..6.....
	0x0020:  a002 faf0 09f5 0000 0204 05b4 0402 080a  ................
	0x0030:  b93d f95b 0000 0000 0103 0307            .=.[........
10:53:20.723463 ARP, Request who-has 192.168.200.10 tell 192.168.200.10, length 46
	0x0000:  0001 0800 0604 0001 840d 8e9b e285 0a0a  ................
	0x0010:  1e26 0000 0000 0000 0a0a 1e26 0000 0000  .&.........&....
	0x0020:  0000 0000 0000 0000 0000 0000 0000       ..............
10:53:21.126854 ARP, Request who-has 192.168.200.10 tell 192.168.200.10, length 46
	0x0000:  0001 0800 0604 0001 840d 8e9b e285 0a0a  ................
	0x0010:  1e26 0000 0000 0000 0a0a 1e26 0000 0000  .&.........&....
	0x0020:  0000 0000 0000 0000 0000 0000 0000       ..............
10:53:22.126768 ARP, Request who-has 192.168.200.10 tell 192.168.200.10, length 46
	0x0000:  0001 0800 0604 0001 840d 8e9b e285 0a0a  ................
	0x0010:  1e26 0000 0000 0000 0a0a 1e26 0000 0000  .&.........&....
	0x0020:  0000 0000 0000 0000 0000 0000 0000       ..............
10:53:23.126962 ARP, Request who-has 192.168.200.10 tell 192.168.200.10, length 46
	0x0000:  0001 0800 0604 0001 840d 8e9b e285 0a0a  ................
	0x0010:  1e26 0000 0000 0000 0a0a 1e26 0000 0000  .&.........&....
	0x0020:  0000 0000 0000 0000 0000 0000 0000       ..............
10:53:24.126567 ARP, Request who-has 192.168.200.10 tell 192.168.200.10, length 46
	0x0000:  0001 0800 0604 0001 840d 8e9b e285 0a0a  ................
	0x0010:  1e26 0000 0000 0000 0a0a 1e26 0000 0000  .&.........&....
	0x0020:  0000 0000 0000 0000 0000 0000 0000       ..............
10:53:25.477031 ARP, Request who-has 192.168.200.10 tell 192.168.200.10, length 46
	0x0000:  0001 0800 0604 0001 840d 8e9b e285 0a0a  ................
	0x0010:  1e26 0000 0000 0000 0a0a 1e26 0000 0000  .&.........&....
	0x0020:  0000 0000 0000 0000 0000 0000 0000       ..............
10:53:25.723395 ARP, Request who-has 192.168.200.10 tell 192.168.200.1, length 28
	0x0000:  0001 0800 0604 0001 0090 27f8 91b7 0a0a  ..........'.....
	0x0010:  1e01 0000 0000 0000 0a0a 1e26            ...........&
10:53:25.724607 ARP, Reply 192.168.200.10 is-at 84:0d:8e:9b:e2:85, length 46
	0x0000:  0001 0800 0604 0002 840d 8e9b e285 0a0a  ................
	0x0010:  1e26 0090 27f8 91b7 0a0a 1e01 0000 0000  .&..'...........
	0x0020:  0000 0000 0000 0000 0000 0000 0000       ..............
10:53:26.126540 ARP, Request who-has 192.168.200.10 tell 192.168.200.10, length 46
	0x0000:  0001 0800 0604 0001 840d 8e9b e285 0a0a  ................
	0x0010:  1e26 0000 0000 0000 0a0a 1e26 0000 0000  .&.........&....
	0x0020:  0000 0000 0000 0000 0000 0000 0000       ..............
10:53:27.128406 ARP, Request who-has 192.168.200.10 tell 192.168.200.10, length 46
	0x0000:  0001 0800 0604 0001 840d 8e9b e285 0a0a  ................
	0x0010:  1e26 0000 0000 0000 0a0a 1e26 0000 0000  .&.........&....
	0x0020:  0000 0000 0000 0000 0000 0000 0000       ..............

I have worked around the issue by having the router forward and SNAT, so the packets appear to come from the 192.168.200.1 address and the communication was restored.

**Comment by davesmeghead** [comment]
To be honest, this is not an issue with the visonic integration. This is a local networking issue and I'm not sure that I or anyone on this github issue would be able to help, you are better posting it somewhere else, perhaps the ESPHOME Github or on the Home Assistant forums.

Because of this, I am closing this as an issue.
